CourseNumber,CourseTitle,Career,Credits,Prerequisites,Antirequisites,Corequisites,Description,spring1,fall1,spring2,fall2
BME617,Clinical Radiation Oncology Physics,Graduate,4.0,NONE,NONE,NONE,"This course is designed to prepare the Medical Physics graduate student in the area of clinical radiation oncology physics.  In this clinical rotation, the student will learn by observation and participation some of a selection of the following medical physics procedures:  LINAC Beam Dosimetry (ion chamber measurement techniques, film dosimetry (radiographic and radiochromic), diode dosimetry, TLD dosimetry, water phantom scanning), implementation of photon and electon beam calibration protocols (AAPM TG51), LINAC beam data measurement and tabulation, commissioning a TPS system, LINAC, acceptance testing, LINAC monthly QA, HDR QA and planning, and IMRT inverse planning and IMRT clinical QA.  A total of 120 clinical hours will be completed in this program.  Prerequisite:  BME 517 and BME 540 with a B+ or better.
Spring, every year,",1,1,1,1
BME618,Anatomy for Medical Physics,Graduate,4.0,NONE,NONE,NONE,"This course provides basic radiographic anatomy from both the projection and cross sectional point of view. This course also introduces basic disease processes including the nature and causes of disease and injury. The appearance of these diseases and injuries are examined on medical images acquired through all current methods: radiography, computed tomography, angiography, magnetic resonance, scintigraphy, positron emission tomography and  sonography. Details of cancer initiation, growth, staging and treatment are considered.
Prerequisite: In Medical Physic Track",1,1,1,1
BME620,Space Radiation Biology,Graduate,4.0,NONE,NONE,NONE,"An extensive series of lectures, training sessions and laboratory activities sponsored by the NASA's Radiation Health Program in collaboration with BNL. The material is oriented to cover basic and state of the art concepts in space radiation environment, physics and radiobiology. Content includes basic concepts in physics, dosimetry, radiobiology, space radiation problems and accelerator operations. Concurrent sessions are provided to complete specific BNL training and plan and prepare experiments for low- and high-LET radiation exposures. Students are trained in NSRL operations and are able to run control experiments using gamma rays in preparation for NSRL runs, and subsequently experiments at the NSRL using heavy ions. Data are obtained from different endpoints are discussed and analyzed with the instructors. Homework are used to test the student's level of comprehension of the lectures and laboratory activities. The write up of a full BNL beam time request proposal is required of each student.",1,1,1,1
BME670,Special Topics in Biomedical Engineering,Graduate,0.00 - 3.00,NONE,NONE,NONE,"Varying topics covering current active research projects and professional development skills for Biomedical Engineers. This course is designed to give the necessary flexibility to students and faculty to introduce and refine new material into the curriculum before it has attracted sufficient interest to be made part of the regular course material. Topics include biomedical engineering, regenerative medicine, bioimaging, biomechanics, career planning, negotiation, communications, long-range planning, among others.",1,1,1,1
BME690,Biomedical Engineering Research,Graduate,1.00 - 9.00,NONE,NONE,NONE,"Biomedical Engineering research for doctoral students who have already received their M.S. degree, but have not yet advanced to candidacy.
Fall and Spring,",1,1,1,1
BME698,Practicum in Teaching,Graduate,1.0,NONE,NONE,NONE,"Undergraduate teaching to be supervised by a faculty member of the Program in Biomedical Engineering. Course to be identified by the student and graduate studies director.
Fall and Spring,",1,1,1,1
BME699,Dissertation Research on Campus,Graduate,1.00 - 9.00,NONE,NONE,NONE,"Prerequisite: Students must be advanced to candidacy (G5); permission of instructor and enroll in appropriate section. Major portion of research must take place on SBU campus, at Cold Spring Harbor, or at the Brookhaven National Lab.
Fall, Spring, and Summer,",1,1,1,1
BME700,Dissertation Research off Campus - Domestic,Graduate,1.00 - 9.00,NONE,NONE,NONE,"Prerequisite: Must be advanced to candidacy (G5). Major portion of research will take place off-campus, but in the United States and/or U.S. provinces. Please note, Brookhaven National Labs and the Cold Spring Harbor Lab are considered on-campus.
All international students must enroll in one of the graduate student insurance plans and should be advised by an International Advisor.
Fall, Spring, Summer",1,1,1,1
BME701,Dissertation Research off Campus - International,Graduate,1.00 - 9.00,NONE,NONE,NONE,"Prerequisite: Must be advanced to candidacy (G5). Major portion of research will take place outside of the United States and/or U.S. provinces.
Domestic students have the option of the health plan and may also enroll in MEDEX.
International students who are in their home country are not covered by mandatory health plan and must contact the Insurance Office for the insurance charge to be removed.
International students who are not in their home country are charged for the mandatory health insurance. If they are to be covered by another insurance plan they must file a waiver be second week of classes. The charge will only be removed if other plan is deemed comparable.
All international students must received clearance from an International Advisor.
Fall, Spring, Summer",1,1,1,1
BME800,BME RESEARCH,Graduate,0.0,NONE,NONE,NONE,Full-time summer research.,1,1,1,1
