CourseNumber,CourseTitle,Career,Credits,Prerequisites,Antirequisites,Corequisites,Description,spring1,fall1,spring2,fall2
BME505,Principles and Practice of Biomedical Engineering,Graduate,1.0,NONE,NONE,NONE,"Introduces first year students to the basic and clinical research at the cutting edge of biomedical engineering. The course has two key components: the first is a seminar series presented by internationally renowned bioengineers. An interactive discussion of topic-specific scientific literature precedes the formal presentation. The second component of the course is teaming up with a physician, in rounds, the operating theater, clinics, etc., to get exposure to the real-life problems which face the medical community. It is hoped that the mix of science and clinic will move students towards determining how they can make contributions to health and society.
2 Credits, ABCF Grading",1,1,1,1
BME508,Molecular and Cellular Biomechanics,Graduate,3.0,NONE,NONE,NONE,"Course content revolves around the effects and interactions of mechanical forces at the cellular and molecular level.  The topics range from describing the molecular and cellular basis of the adaptation of tissues to physical signals, to prescribing specific mechanical environments for improved tissue engineering, to delineating relevant molecular, cellular, and biomechanical techniques, to issues involved in the development and approval of diagnostics and therapeutics in molecular engineering.  Course format is based on lectures and discussion of the current literature. For a deeper understanding of the scientific literature, this course will contain a module on the design and analysis of experiments (i.e., applied biostatistics).  

Fall and Spring, 3 credits, Letter graded (A, A-, B+, etc.)
May be repeated 2 times FOR credit.",1,1,1,1
BME509,Fundamentals of the Bioscience Industry,Graduate,3.0,NONE,NONE,NONE,"A 4-module course set up to provide students with a comprehensive introduction to the complexities of the bioscience business environment.
Prerequisite: Must be either a BME or MBA graduate student (West Campus).  All other students must obtain permission from the instructor.
Spring, every year,",1,1,1,1
BME510,Biomechanics,Graduate,3.0,NONE,NONE,NONE,"This course emphasizes the application of continuum mechanics to living tissues and organs in order to describe the material properties and their behavior under loading and stress. The interrelationship between biomechanics and physiology is examined in normal function and in disease processes. This course focuses on the physiology of tissue and organ systems in the context of mechanics, stress, strain, viscoelasticity and material behavior, and the constitutive equations and the field equations governing fluids and fluid flow, with an emphasis on the cardiovascular and musculoskeletal systems. Emphasis is placed on the utilization of engineering principles to analyze processes at the tissue and organ levels, covering soft and hard tissues and organs (blood, cardiovascular system, bone, cartilage, etc.) and to understand how these principles could be applied towards the design and development of prosthetic devices.
(Fall Term, Three Credits).",1,1,1,1
BME511,BioTechnology Enterprises 2: Products & Markets,Graduate,3.0,NONE,NONE,NONE,"This course will provide students with a comprehensive introduction to the bioscience business environment by examining the commercialization process ¿ how an idea becomes a product. This includes evolving business models, product development cycles, regulatory issues, finance, managerial challenges and future trends in the life sciences. Special focus will be placed on preparing students to translate concepts presented in the course into commercial analysis of a technology. Must be either BME or MBA Graduate Student (West Campus)",1,1,1,1
BME512,Fundamentals of the Bioscience Industry,Graduate,3.0,NONE,NONE,NONE,"This course will build on topics presented in BME-511: Fundamentals of the Bioscience Industry Program, and is a pre- or co-requisite for enrollment. Students will work through modules addressing each component of the commercialization process including intellectual property strategy, market analysis and opportunity, regulatory pathway and technology financing. Students will work in groups to develop commercialization reports based on real intellectual property disclosures, preforming due diligence to identify areas of opportunity and challenges of their technologies. Based upon the commercialization report, students¿ groups will create a hypothetical company, and evolve their technology analyses into investor-like presentations delivered at a mock pitch session at the end of the term.",1,1,1,1
BME513,Introduction To Optical & Terahertz Imaging,Graduate,3.0,NONE,NONE,NONE,"This course provides the foundations for advanced topics in modern optical imaging techniques,
including nonlinear optics, Fourier optics, ultrafast time-domain and terahertz spectroscopy and
imaging. The emphasis will be on connecting theory to modern technological advancements
and their biomedical applications. The course consists of the following four general modules:
Review of fundamental Optics; Nonlinear Optics; Fourier Optics; Ultrafast and Terahertz Optics",1,1,1,1
BME515,Biomedical Optical Imaging,Graduate,3.0,NONE,NONE,NONE,"An introduction to the principles and applications of biomedical optical imaging, with an emphasis on high-resolution imaging and spectroscopy. This course provides a conceptual overview, along with basic mathematical theory (assignments), of some of the key concepts that are relevant to biomedical optical imaging, including Gaussian beams, refraction, total internal
reflection, dispersion, coherence, interference, diffraction, and aberrations. Fundamental concepts in tissue optics will be introduced, including scattering in the ballistic and diffuse regimes. Some of the basic photophysics of absorption, fluorescence, and Raman spectroscopy will be discussed. Students will research and present on various techniques such
as interferometry (optical coherence tomography), optical-sectioning microscopy (confocal and multiphoton), light-scattering spectroscopy (LSS, CLASS), and super-resolution microscopy (PALM, STORM, SIM, and STED). Finally, a brief survey of optical molecular imaging will be
provided, including contrast agent design, delivery issues, and imaging techniques.",1,1,1,1
BME517,Radiation Physics,Graduate,3.0,NONE,NONE,NONE,"This graduate offering provides an initial physical background required for the study of the Medical Physics. Sources of ionizing radiation including radioactivity (natural and manmade) and x-ray producing devices are studied as well as sources of nonionizing radiation such as radiofrequency and ultrasound. The physical aspects of these radiations are characterized by their interaction with matter and methods for their detection. Each student will select and present a proposal for solving a clinical medical physics problem.
Prerequisites: Modern Physics or equivalent
Fall,",1,1,1,1
BME518,Radiobiology,Graduate,3.0,NONE,NONE,NONE,"The biological consequences of irradiation (ionizing, ultrasound, laser, RF, etc.) will be examined. Interaction mechanisms will first be examined followed by examination of the radiation impact at the molecular and cellular level. The use of radiation for therapeutic gain will be considered. As well, models will be developed for risk estimates. Topics to be covered will include: target theory, biological response, NSD and risk estimates.
Spring,",1,1,1,1
BME519,Medical Health Physics,Graduate,3.0,NONE,NONE,NONE,"This course discusses the health physics and safety issues associated with radiological devices, facilities and procedures.
Prerequisite: BME 517.
Spring,",1,1,1,1
BME520,Lab Rotation I,Graduate,1.00 - 3.00,NONE,NONE,NONE,,1,1,1,1
BME521,Lab Rotation II,Graduate,1.00 - 3.00,NONE,NONE,NONE,,1,1,1,1
BME525,Pathways from Bed to Bedside,Graduate,3.0,NONE,NONE,NONE,"The course will emphasize diverse pathways from laboratory discoveries to product
commercialization in Tissue Engineering and Regenerative Medicine (TERM). Depending on the field of discovery, pathways can be quite dissimilar, e.g. devices, biologics, drugs, or combination products. The foundational sciences include: biomaterials, biological processes including cell biology and physiology, genomics, proteomics, metabolomics, stem cell differentiation, growth factors, and tissue/organ development. An overarching core principle is
engineering design. The course will be divided into 3 modules: Discovery and validation, Transition from laboratory prototype to fixed prototype, Progression through clinical trials. Although scale-up manufacturing and commercialization will be discussed, these final steps to the market-place will not be covered in detail. Students will work in teams. Each team will
select a TERM project with a specific type of bench to bedside pathway (team size will depend on the class size). However, other BME areas may be included, e.g. microelectron-mechanical systems (MEMS), can be designed to stimulate muscle, thus avoid atrophy while awaiting a TERM construct. For such projects, the team should choose an appropriate BME faculty advisor to guide them. Reading material and writing/speaking assignments will be the basis for in-class
discussions with embellishment of specific engineering or scientific principles.",1,1,1,1
BME526,Biological Systems Engineering,Graduate,3.0,NONE,NONE,NONE,"This course is a hands-on study of systems engineering in biology, using computer modeling to conceptualize and simulate a wide variety of applications.  All skills taught in class. Appropriate and applicable to all BME tracks. May not be repeated for credit.
Fall, Spring , 3 Credits ABCF Grading",1,1,1,1
BME530,Medical Image Formation,Graduate,3.0,NONE,NONE,NONE,"This course covers the physical aspects of medical image formation. Image receptor design/optimization, reconstruction techniques, device hardware and performance characteristics are considered.
Fall,",1,1,1,1
BME531,Biosensing and Bioimaging,Graduate,3.0,NONE,NONE,NONE,"Basic concepts of biosensing and bioimaging, which include the elements of biological systems and bioimmobilizers, traditional electrode and novel optical transducers, and advanced biomedical optical imaging systems.
Fall,",1,1,1,1
BME532,Time Series Modeling of Biological Systems,Graduate,3.0,NONE,NONE,NONE,"A unified mathematical/time series framework for modeling and mining biological data.  Applications range from cardio-respiratory, renal blood pressure/flow and sequence (DNA, RNA, proteins) to gene expression data.  Tools of analysis include neural networks, time-invariant and time-varying spectral methods, fractal and nonlinear dynamics techniques, hidden Markov Model, clustering analysis, and various system identification techniques.
Spring,",1,1,1,1
BME533,Biomedical Imaging Quantification and Analysis,Graduate,3.00 - 4.00,NONE,NONE,NONE,"The overall objective is to introduce conceptual, mathematical, and
computational implementational aspects of analyzing biomedical signals and image
processing, including real data with preclinical and clinical applications based on the recently developing neurophotonics and optical neuroimaging field. Programming examples using MATLAB will be presented. The students will also be introduced to GUIbased Virtual Photonics and Virtual Tissue Simulator. Practical and recent studies with current state-of-the-art imaging technologies in the field are also discussed. The course involves traditional-style lectures, small lab experiments to apply the basic concepts, an imaging facility tour, and a concise final paper/grant writeup and presentation on the subject of the student's choice in accordance with the instructor.",1,1,1,1
BME534,Functional Genomics,Graduate,3.0,NONE,NONE,NONE,"Course provides foundation in concepts of functional genomics and proteomics. Topics include organization and complexity of the mammalian genome and mechanisms of expression of genes, gene expression analysis technologies with a strong focus on construction and utilization of DNA microarrays, and tools for determining gene function by perturbation of gene expression.
Spring,",1,1,1,1
BME540,Radiation Oncology Physics,Graduate,3.0,NONE,NONE,NONE,"This course provides a background in therapeutic instrumentation, dosimetry and treatment planning.
Prerequisite: BME 517
Fall,",1,1,1,1
BME546,Statistical Analysis of Physiological Data,Graduate,1.0,NONE,NONE,NONE,"Statistical methods useful in analyzing common types of physiological data. Topics include probability, data distributions, hypothesis testing, with parametric and non-parametric methods, ANOVA, regression and correlation and power analysis. Emphasis is on experimental design and appropriate, efficient use of statistical software.
Permission is required.",1,1,1,1
BME547,Model-Based Analysis of Physiological Data,Graduate,1.0,NONE,NONE,NONE,"The analysis of common biochemical and physiological data by non-linear regression of data models and biophysical models of physiological and biochemical processes. Examples include binding kinetics, compartmental mass transfer and spectral analysis.
Permission is required.",1,1,1,1
BME548,Measurement and Analysis in Physiological Research,Graduate,1.0,NONE,NONE,NONE,"The acquisition and analysis of data-arising from common biochemical and physiological measurements. Topics include computer-based data acquisition and processing, densitometry, microscopy, and image analysis and processing. Emphasis is on experimental design and strategies for optimizing signal to noise ratio of measurements.",1,1,1,1
BME549,Experimental Techniques in Systems Physiology,Graduate,1.0,NONE,NONE,NONE,"A series of lectures and laboratory exercises designed to introduce students to invitro experimental techniques used in systems physiology. Emphasis will be placed on the ethical use of rodents in biomedical research and the measurement of physiological variables. Data acquisition and analysis procedures used in cardio-vascular, respiratory, neural and renal physiology will also be covered.
Permission is required.",1,1,1,1
BME550,Mathematical Models of Physiologic & Biophysical Systems,Graduate,3.0,NONE,NONE,NONE,"An introduction to mathematical modeling of cell and tissue function. Topics include the derivation and numerical solution of models of cell homeostasis, membrane transport and excitability, and cell signaling and metabolism. Grading is based on problems, student presentation, and completion of a modeling project.
Permission is required.",1,1,1,1
BME558,Physical & Quantitative Biology,Graduate,3.0,NONE,NONE,NONE,"¿¿This is a course on the principles of physical chemistry. We describe the nature of the forces and energies and entropies that drive molecular systems toward their states of equilibrium. We consider a broad range of applications throughout chemistry, biology, materials engineering and nanoscience. This course aims to give students an understanding of how the actions and behaviors of materials arise from their atomic and molecular structures. Co-listed with PHY 558 and CHE 558.",1,1,1,1
BME571,Microfluids in Biological Systems,Graduate,3.0,NONE,NONE,NONE,"This course will outline theory and applications of special fluid handling conditions associated with living systems. Fall,
This course will be co-scheduled with BME 371",1,1,1,1
BME572,Biomolecular Analysis,Graduate,3.0,NONE,NONE,NONE,"This interdisciplinary course is intended for graduate students and advanced undergraduates in departments such as Biomedical Engineering, Chemistry, Physics, Biology and Chemical Engineering. This course will give an introduction to single molecule experiments using fluorescence, optical traps, AFM cantilevers, microneedles, magnetic microbeads as well as micro and nanofluidic devices.
Prerequisites: BME 501 and 502, or instructor approval.
Fall,",1,1,1,1
BME573,iPhone Programming for Medical Applications,Graduate,3.0,NONE,NONE,NONE,iPhone Programming for Medical Applications.,1,1,1,1
BME574,Machine Learning and Artificial Intelligence for Biomedical Engineering,Graduate,3.0,NONE,NONE,NONE,"This course introduces students to machine learning and artificial intelligence methods applied to Biomedical Engineering problems. We will cover singular-value decomposition (SVD), and principal components analysis (PCA), Fourier and Wavelet Transforms, Regression and Model Selection, Clustering and Classification, Deep Learning using Neural Networks, and Scientific Machine Learning. Course emphasis will be placed on the concepts and implementation of machine learning and AI methods as implemented in the Julia programming language. The final project will teach the students how to apply the various methods learned and practiced in the class to tackle real-world complex BME challenges.",1,1,1,1
BME581,Biomedical Nanofabrication,Graduate,3.0,NONE,NONE,NONE,"This one-semester, three section course, serves as an introduction to the applications of nanofabrication to various fields of importance to biomedical engineering. This will be done by a combination of examining how nature has accomplished nano-scale feats, how we can measure this, and whether we can duplicate nature¿s functions in vitro. A significant portion of the course includes technical communications, in the form of a written report and oral lecture component to class.",1,1,1,1
BME590,Biomedical Engineering Seminar,Graduate,0.00 - 1.00,NONE,NONE,NONE,"A weekly meeting devoted to current graduate student work in the program in Biomedical Engineering. Enrolled students present seminar each week throughout the semester, participate in seminars and responsible conduct of research training.",1,1,1,1
BME595,BME MS Project,Graduate,1.00 - 6.00,NONE,NONE,NONE,"This course is taken M.S. students who select MS Project track.  Conducted jointly by graduate students and one or more members of the faculty.  A final project report must be submitted to the advisor as well as to the Graduate Program Director.  Without the submitted report, credits from this course cannot be applied toward the MS degree.",1,1,1,1
BME599,Biomedical Engineering Research,Graduate,1.00 - 9.00,NONE,NONE,NONE,"Research to be supported by a faculty member of the Department of Biomedical Engineering. Students must have permission of instructor to enroll in appropriate section. Faculty to be identified by the student.
Fall and Spring,",1,1,1,1
BME601,Cardiovascular Fluid Mechanics,Graduate,3.0,NONE,NONE,NONE,"The course will cover the application of fluid mechanics principles to the analysis of blood flow in the cardiovascular system under normal and pathological conditions.  It will follow an historical time line by beginning with the most basic models of arterial blood flow, and proceed to the most advanced theories related to physiology and pathology flow phenomena, including an examination of the most up to date research in the area and the development of devices and implants.
Spring, alternate years,",1,1,1,1
BME602,Topics in Biomedical Applications of Neural Networks,Graduate,3.0,NONE,NONE,NONE,"This is a project based course which includes weekly seminars discussing advanced topics in fuzzy logic and neural networks and their applications, in biomedical devices.  Applications include drug delivery, diagnostics, management information handling.  Students utilize simulation software to develop algorithms to deal successfully with training data sets of their own choosing.
Fall, alternate years,",1,1,1,1
BME603,Advanced Quantitative Human Physiology,Graduate,3.0,NONE,NONE,NONE,"This course is intended to provide a deep and rigorous understanding of human physiology using a quantitative approach. This course will develop the physical, chemical and mathematical foundation of physiology, which is then applied to membranes, transport, metabolisms, excitable cells and various organ systems. A major component of this course will be an individual project requiring mastery of concepts developed in class.",1,1,1,1
BME604,Finite Element Modeling in Biology and Medicine,Graduate,3.0,NONE,NONE,NONE,"Both finite difference and FEM are applied to solve the equations of incompressible and compressible fluid flow in porous media with emphasis on flows in skeletal tissues, i.e., bone and cartilage.  Steady-state, transient flow, permeability and surface boundary conditions are discussed.  Practical and recent studies in the field are also discussed.  Programming using FORTRAN or C languages will be required.  The student is also introduced to commercially available software packages.
Spring, alternate years,
This course will be co-scheduled with BME420.",1,1,1,1
BME605,Biomechanics of Tactile Sensory Systems,Graduate,3.0,NONE,NONE,NONE,"Detailed study of the biomechanics of tactile neurophysiology for engineers entering the field of haptics and robotics manipulations.  Anatomy and electrophysiology of transducer cells and neurons starting at the fingertips and extending to the somatosensory cortex.  Characteristics of the external stimulus and its peripheral transformation.  Relations of these topics to perceptual and/or behavioral responses.
Spring, alternate years,",1,1,1,1
BME608,Contemporary Biotechnology,Graduate,3.0,NONE,NONE,NONE,"General discussion on the nature of biotechnology and its historical development, applications, impact, consequences, and some of the social and ethical considerations.
Co-scheduled with BME 402
Offered Fall, 3 Credits, ABCF Grading",1,1,1,1
BME610,Magnetic Resonance,Graduate,3.0,NONE,NONE,NONE,"This course provides a comprehensive study of magnetic resonance and its applications in medical imaging. An introduction of NMR is followed with development of the hardware and processing aspects required for MR image formation. An overview of basic and advanced MR imaging techniques is provided. Each student will select a topic in MR imaging for presentation at the conclusion of the course. 
Fall,",1,1,1,1
BME611,Positron Emission Tomography,Graduate,3.0,NONE,NONE,NONE,"Positron emission tomography (PET) is a unique and powerful functional imaging method used in the clinic and in medical research.  It is a multidisciplinary endeavor involving the fields of chemistry, physics, mathematics and medicine.  This course addresses the disparate areas of science underlying PET imaging, including radioisotope production, radiotracer synthesis, the physics of the imaging process, quantitative data processing, image reconstruction approaches, data analysis, and tracer kinetic modeling to extract quantitative physiological parameters.  Radioactive validation and applications of PET will also be covered including the area of drug addiction.  There is a hands-on component in which students will visit an active PET research center and acquire and manipulate PET data.",1,1,1,1
BME612,Biomedical Engineering Aspects for the Use of Radiation in Medicine,Graduate,3.0,NONE,NONE,NONE,"This course provides a comprehensive study of the use of radiation in medicine. Physical aspects of the interaction of radiation with matter and for the radiation production are initially considered. The underlying principles of current radiation based medical imaging is considered next. Topics include radiography, fluoroscopy, radionuclide imaging and computed tomography. The use of radiation for the treatment of malignancy is considered with the focus on required technology. Finally advanced applications of radiation are considered with focus on imaging and treatment. Each student will select a topic examining the engineering or technical application of radiation in medicine for presentation at the conclusion of the course.
Spring,",1,1,1,1
BME615,Clinical Nuclear Imaging,Graduate,4.0,NONE,NONE,NONE,"This course is designed to prepare the Medical Physics graduate student in the area of clinical Medical Imaging.  In this clinical rotation, medical physics methods for: planar film, DR, CR, mamography, fluoroscopy, CT, ultrasound and MRI performance evaluations will be introduced.  In addition, basic medical ethics, radiographic anatomy and radiation safety will be covered.  A total of 200 clinical hours will be completed in this program
Prerequisites: BME 517; BME 518; BME 519; BME 530 or BME 540.
Fall, every year,",1,1,1,1
BME616,Clinical Nuclear Medicine Imaging,Graduate,4.0,NONE,NONE,NONE,"This course is designed to prepare the Medical Physics graduate student in the area of clinical Nuclear Medicine Imaging.  In this clinical rotation, the students will be exposed to radionuclide processes, radiopharmaceuticlas including radioactive gases and aerosols-prepartio, characteristics and radiation dosimetry, in vitro and in vivo radiation detection systems, imaging systems and their performance evaluations.  In addition, basic medical ethics, clinical interpretations and radiation safety will be covered.  A total of 150 clinical hours will be completed in this program.
Fall, every year,",1,1,1,1
